Symbol,Name,Last Sale,Net Change,% Change,Market Cap,Country,IPO Year,Volume,Sector,Industry
GNL,Global Net Lease Inc. Common Stock,$9.47,0.22,2.378%,2076126519.00,United States,2015,2327031,Real Estate,Real Estate Investment Trusts
GNRC,Generac Holdlings Inc. Common Stock,$160.85,-0.58,-0.359%,9439332016.00,United States,2010,608099,Consumer Discretionary,Metal Fabrications
GNTX,Gentex Corporation Common Stock,$23.93,-0.07,-0.292%,5239304052.00,United States,,2730844,Consumer Discretionary,Auto Parts:O.E.M.
GNW,Genworth Financial Inc Common Stock,$8.38,0.08,0.964%,3346809151.00,United States,2004,5160202,Finance,Life Insurance
GOLF,Acushnet Holdings Corp. Common Stock,$91.88,-1.24,-1.332%,5389802909.00,United States,2016,348520,Consumer Discretionary,Recreational Games/Products/Toys
GPCR,Structure Therapeutics Inc. American Depositary Shares,$88.64,3.62,4.258%,6128497890.00,United States,2023,1622972,Health Care,Biotechnology: Pharmaceutical Preparations
GPI,Group 1 Automotive Inc. Common Stock,$395.06,-2.04,-0.514%,4989851552.00,United States,1997,176027,Consumer Discretionary,Retail-Auto Dealers and Gas Stations
GPK,Graphic Packaging Holding Company,$15.28,-0.16,-1.036%,4509481151.00,United States,,3024189,Consumer Discretionary,Containers/Packaging
GPOR,Gulfport Energy Corporation Common Shares,$178.94,1.04,0.585%,3456551592.00,United States,2021,177536,Energy,Oil & Gas Production
GRAL,GRAIL Inc. Common Stock ,$96.70,-0.74,-0.759%,3769580964.00,United States,,727551,Health Care,Medical Specialities
GRBK,Green Brick Partners Inc. Common Stock,$73.44,-0.75,-1.011%,3199420797.00,United States,2021,209674,Consumer Discretionary,Homebuilding
GSAT,Globalstar Inc. Common Stock,$60.16,-2.63,-4.189%,7630598986.00,United States,2025,1374937,Consumer Discretionary,Telecommunications Equipment
GSHD,Goosehead Insurance Inc. Class A Common Stock,$71.57,-0.53,-0.735%,2636944404.00,United States,2018,214236,Finance,Specialty Insurers
GT,The Goodyear Tire & Rubber Company Common Stock,$9.09,-0.23,-2.468%,2601202663.00,United States,,4790524,Consumer Discretionary,Automotive Aftermarket
GTLB,GitLab Inc. Class A Common Stock,$34.14,-0.61,-1.755%,5749176000.00,United States,2021,4693186,Technology,Computer Software: Prepackaged Software
GTLS,Chart Industries Inc. Common Stock,$207.41,0.35,0.169%,9323691982.00,United States,2006,565823,Industrials,Metal Fabrications
GTM,ZoomInfo Technologies Inc Common Stock,$9.035,-0.965,-9.65%,2815238545.00,United States,2020,8125202,Technology,Computer Software: Prepackaged Software
GVA,Granite Construction Incorporated Common Stock,$121.36,0.38,0.314%,5297340456.00,United States,,960548,Industrials,Military/Government/Technical
GXO,GXO Logistics Inc. Common Stock ,$56.54,-0.60,-1.05%,6473232768.00,United States,2021,845126,Consumer Discretionary,Transportation Services
HAE,Haemonetics Corporation Common Stock,$72.17,-1.83,-2.473%,3378254028.00,United States,1991,1038542,Health Care,Medical/Dental Instruments
HALO,Halozyme Therapeutics Inc. Common Stock,$71.21,-0.61,-0.849%,8374082370.00,United States,,1271550,Health Care,Biotechnology: Biological Products (No Diagnostic Substances)
HASI,HA Sustainable Infrastructure Capital Inc. Common Stock,$34.47,0.11,0.32%,4111536582.00,United States,2013,867509,Finance,Finance/Investors Services
HAYW,Hayward Holdings Inc. Common Stock,$16.85,0.11,0.657%,3654145577.00,United States,2021,1324222,Industrials,Industrial Machinery/Components
HCC,Warrior Met Coal Inc. Common Stock,$100.07,-2.37,-2.314%,5260695511.00,United States,2017,905907,Energy,Coal Mining
HCI,HCI Group Inc. Common Stock,$175.95,1.00,0.572%,2280318510.00,United States,,117337,Finance,Property-Casualty Insurers
HCXY,Hercules Capital Inc. 6.25% Notes due 2033,$25.16,-0.02,-0.079%,4570960184.00,United States,2018,2204,Finance,Investment Managers
HE,Hawaiian Electric Industries Inc. Common Stock,$14.45,0.17,1.19%,2494365878.00,United States,,3228313,Utilities,Electric Utilities: Central
HESM,Hess Midstream LP Class A Representing Limited Partner Interests,$34.97,0.08,0.229%,4524851459.00,United States,2017,1143549,Energy,Oil & Gas Production
HGTY,Hagerty Inc. Class A Common Stock,$12.67,-0.10,-0.783%,4333951501.00,United States,2021,63259,Finance,Specialty Insurers
HGV,Hilton Grand Vacations Inc. Common Stock ,$46.71,-1.48,-3.071%,3995717874.00,United States,2016,897339,Consumer Discretionary,Hotels/Resorts
HHH,Howard Hughes Holdings Inc. Common Stock,$83.66,0.24,0.288%,4968647714.00,United States,,238399,Real Estate,Real Estate Investment Trusts
HI,Hillenbrand Inc Common Stock,$31.82,-0.01,-0.031%,2243526981.00,United States,,622145,Consumer Discretionary,Miscellaneous manufacturing industries
HIMS,Hims & Hers Health Inc. Class A Common Stock,$31.38,0.15,0.48%,7143610369.00,United States,2019,14523897,Health Care,Medical/Nursing Services
HIW,Highwoods Properties Inc. Common Stock,$27.54,0.34,1.25%,3026479163.00,United States,1994,1073880,Real Estate,Real Estate Investment Trusts
HLIO,Helios Technologies Inc. Common Stock,$64.09,1.18,1.876%,2123205180.00,United States,2021,473787,Industrials,Metal Fabrications
HLNE,Hamilton Lane Incorporated Class A Common Stock,$152.79,-1.05,-0.683%,8526253129.00,United States,2017,562481,Finance,Investment Managers
HNGE,Hinge Health Inc. Class A Common Stock,$43.33,-0.43,-0.983%,3410912209.00,United States,2025,746686,Technology,EDP Services
HNI,HNI Corporation Common Stock,$47.19,1.07,2.32%,2162777207.00,United States,,557025,Consumer Discretionary,Office Equipment/Supplies/Services
HOG,Harley-Davidson Inc. Common Stock,$20.49,-0.58,-2.753%,2420726773.00,United States,,2691993,Consumer Discretionary,Motor Vehicles
HOMB,Home BancShares Inc. Common Stock,$28.94,0.07,0.242%,5687936477.00,United States,2006,1788254,Finance,Major Banks
HP,Helmerich & Payne Inc. Common Stock,$32.38,0.11,0.341%,3187758318.00,United States,,945505,Energy,Oil & Gas Production
HQY,HealthEquity Inc. Common Stock,$85.37,-1.57,-1.806%,7293695736.00,United States,2014,1115303,Real Estate,Real Estate
HR,Healthcare Realty Trust Incorporated Common Stock,$17.26,0.12,0.70%,6069111172.00,United States,,2552716,Real Estate,Real Estate Investment Trusts
HRB,H&R Block Inc. Common Stock,$42.05,-0.63,-1.476%,5316184075.00,United States,,2158616,Consumer Discretionary,Other Consumer Services
HRI,Herc Holdings Inc. Common Stock ,$157.95,-0.86,-0.542%,5254951326.00,United States,2016,341548,Industrials,Misc Corporate Leasing Services
HRMY,Harmony Biosciences Holdings Inc. Common Stock,$36.22,-0.19,-0.522%,2086140087.00,United States,2020,648690,Health Care,Biotechnology: Pharmaceutical Preparations
HSIC,Henry Schein Inc. Common Stock,$79.98,1.90,2.433%,9415630064.00,United States,1995,1925410,Health Care,Medical Specialities
HTFL,Heartflow Inc. Common Stock,$37.16,1.04,2.879%,3164497998.00,United States,2025,826947,Health Care,Medical/Dental Instruments
HTGC,Hercules Capital Inc. Common Stock,$18.91,-0.06,-0.316%,3436288798.00,United States,2012,1005210,Finance,Investment Managers
HTH,Hilltop Holdings Inc.,$35.69,-0.14,-0.391%,2188815486.00,United States,,283308,Finance,Major Banks
HUBG,Hub Group Inc. Class A Common Stock,$46.87,-0.57,-1.202%,2866265014.00,United States,1996,473197,Industrials,Integrated Freight & Logistics
HUN,Huntsman Corporation Common Stock,$11.91,-0.14,-1.162%,2069374720.00,United States,2005,5755558,Industrials,Major Chemicals
HURN,Huron Consulting Group Inc. Common Stock,$183.46,-2.12,-1.142%,3163119719.00,United States,2004,127905,Consumer Discretionary,Professional Services
HUT,Hut 8 Corp. Common Stock,$59.65,2.37,4.138%,6444385099.00,United States,,5425097,Finance,Finance: Consumer Services
HWC,Hancock Whitney Corporation Common Stock,$68.34,-0.08,-0.117%,5714120757.00,United States,,650713,Finance,Major Banks
HWCPZ,Hancock Whitney Corporation 6.25% Subordinated Notes due 2060,$23.9699,0.3799,1.61%,2031568347.00,United States,,9511,Finance,Major Banks
HWKN,Hawkins Inc. Common Stock,$152.00,-1.19,-0.777%,3175316328.00,United States,,107586,Consumer Discretionary,Specialty Chemicals
HXL,Hexcel Corporation Common Stock,$82.59,-1.67,-1.982%,6574649216.00,United States,,1256272,Industrials,Major Chemicals
HYMC,Hycroft Mining Holding Corporation Class A Common Stock,$34.63,0.04,0.116%,2875169048.00,United States,2018,3056206,Basic Materials,Precious Metals
IAC,IAC Inc. Common Stock,$39.51,-1.07,-2.637%,3059379568.00,United States,,737695,Technology,Computer Software: Programming Data Processing
IBOC,International Bancshares Corporation Common Stock,$70.38,-0.31,-0.439%,4375094367.00,United States,,275089,Finance,Major Banks
IBP,Installed Building Products Inc. Common Stock,$309.70,-4.70,-1.495%,8400723063.00,United States,2014,307484,Consumer Discretionary,Homebuilding
IBRX,ImmunityBio Inc. Common Stock,$5.52,1.57,39.747%,5437007788.00,United States,2015,177968425,Health Care,Biotechnology: Biological Products (No Diagnostic Substances)
ICUI,ICU Medical Inc. Common Stock,$156.17,1.05,0.677%,3855315692.00,United States,1992,310575,Health Care,Medical/Dental Instruments
IDA,IDACORP Inc. Common Stock,$134.61,1.88,1.416%,7275027603.00,United States,,434175,Utilities,Electric Utilities: Central
IDCC,InterDigital Inc. Common Stock,$308.76,-1.67,-0.538%,7948887876.00,United States,,216454,Miscellaneous,Multi-Sector Companies
IDYA,IDEAYA Biosciences Inc. Common Stock,$35.84,-0.22,-0.61%,3141964063.00,United States,2019,820594,Health Care,Biotechnology: Pharmaceutical Preparations
IEP,Icahn Enterprises L.P. Common Stock,$7.81,-0.05,-0.636%,4687628518.00,United States,,714505,Consumer Discretionary,Auto Parts:O.E.M.
IESC,IES Holdings Inc. Common Stock,$460.09,27.405,6.334%,9134896013.00,United States,,278395,Industrials,Engineering & Construction
IMNM,Immunome Inc. Common Stock,$22.41,-0.44,-1.926%,2472538955.00,United States,2020,1956130,Health Care,Biotechnology: Pharmaceutical Preparations
IMVT,Immunovant Inc. Common Stock,$26.27,0.27,1.038%,5324358337.00,United States,2019,1678274,Health Care,Biotechnology: Biological Products (No Diagnostic Substances)
INDB,Independent Bank Corp. Common Stock,$76.45,-0.17,-0.222%,3790181909.00,United States,,260294,Finance,Major Banks
INGM,Ingram Micro Holding Corporation Common Stock,$21.24,-0.06,-0.282%,4992943192.00,United States,2024,490380,Technology,Retail: Computer Software & Peripheral Equipment
INGR,Ingredion Incorporated Common Stock,$114.90,-1.84,-1.576%,7299612741.00,United States,,463001,Consumer Staples,Packaged Foods
INSP,Inspire Medical Systems Inc. Common Stock,$92.23,-4.24,-4.395%,2679874908.00,United States,2018,454948,Health Care,Medical/Dental Instruments
INSW,International Seaways Inc. Common Stock ,$56.37,0.59,1.058%,2784907877.00,United States,2016,448338,Consumer Discretionary,Marine Transportation
INTA,Intapp Inc. Common Stock,$38.29,-1.13,-2.867%,3136964957.00,United States,2021,723036,Technology,Computer Software: Prepackaged Software
IPAR,Interparfums Inc. Common Stock,$89.93,-0.49,-0.542%,2883580989.00,United States,,196356,Consumer Discretionary,Package Goods/Cosmetics
IPGP,IPG Photonics Corporation Common Stock,$81.75,1.72,2.149%,3443676322.00,United States,2006,388933,Technology,Semiconductors
IRON,Disc Medicine Inc. Common Stock,$70.93,-0.11,-0.155%,2677618991.00,United States,,454807,Health Care,Biotechnology: Pharmaceutical Preparations
IRT,Independence Realty Trust Inc. Common Stock,$17.26,0.18,1.054%,4127090069.00,United States,2013,2720921,Real Estate,Real Estate Investment Trusts
IRTC,iRhythm Holdings Inc. Common Stock,$167.16,-4.88,-2.837%,5385751944.00,United States,2016,762216,Health Care,Medical/Dental Instruments
ITGR,Integer Holdings Corporation Common Stock,$85.78,0.50,0.586%,3005596182.00,United States,,539244,Health Care,Biotechnology: Electromedical & Electrotherapeutic Apparatus
ITRI,Itron Inc. Common Stock,$100.04,-0.87,-0.862%,4581969155.00,United States,1993,318464,Industrials,Electrical Products
IVT,InvenTrust Properties Corp. Common Stock,$29.07,0.40,1.395%,2256395377.00,United States,2021,290663,Real Estate,Real Estate Investment Trusts
JBTM,JBT Marel Corporation Common Stock,$158.88,-0.19,-0.119%,8257211583.00,United States,,433315,Industrials,Industrial Machinery/Components
JOE,St. Joe Company (The) Common Stock,$65.39,-0.11,-0.168%,3775914817.00,United States,,156630,Real Estate,Homebuilding
JXN,Jackson Financial Inc. Class A Common Stock ,$113.54,-1.30,-1.132%,7717298131.00,United States,2021,545363,Finance,Life Insurance
KAI,Kadant Inc Common Stock,$324.94,-2.34,-0.715%,3827187187.00,United States,1992,132939,Industrials,Industrial Machinery/Components
KALU,Kaiser Aluminum Corporation Common Stock,$128.24,-2.98,-2.271%,2078290141.00,United States,,162346,Industrials,Metal Fabrications
KBH,KB Home Common Stock,$61.32,-0.92,-1.478%,3971370484.00,United States,1986,1281372,Consumer Discretionary,Homebuilding
KBR,KBR Inc. Common Stock,$44.68,-0.30,-0.667%,5673896579.00,United States,2006,1039325,Industrials,Military/Government/Technical
KD,Kyndryl Holdings Inc. Common Stock,$25.21,-1.84,-6.802%,5762107188.00,United States,2021,3157765,Technology,EDP Services
KEX,Kirby Corporation Common Stock,$125.88,-0.43,-0.34%,6822696000.00,United States,,2057578,Consumer Discretionary,Marine Transportation
KFY,Korn Ferry Common Stock,$67.97,-0.77,-1.12%,3547690344.00,United States,1999,338397,Consumer Discretionary,Diversified Commercial Services
KGS,Kodiak Gas Services Inc. Common Stock,$37.73,0.94,2.555%,3270582038.00,United States,2023,2687427,Utilities,Natural Gas Distribution
KMPR,Kemper Corporation,$38.49,-0.12,-0.311%,2253468641.00,United States,,648596,Finance,Property-Casualty Insurers
KMT,Kennametal Inc. Common Stock,$34.02,-0.54,-1.563%,2588688487.00,United States,,1176941,Industrials,Industrial Machinery/Components
KMX,CarMax Inc,$48.83,0.31,0.639%,6923929980.00,United States,,3134790,Consumer Discretionary,Retail-Auto Dealers and Gas Stations
KN,Knowles Corporation Common Stock,$24.58,-0.35,-1.404%,2093033309.00,United States,2014,719436,Consumer Staples,Consumer Electronics/Appliances
KNF,Knife Riv Holding Co. Common Stock,$83.33,3.09,3.851%,4721824869.00,United States,2023,573596,Industrials,Mining & Quarrying of Nonmetallic Minerals (No Fuels)
KNSA,Kiniksa Pharmaceuticals International plc Class A Ordinary Shares,$39.41,1.49,3.929%,2987110862.00,United States,2018,765492,Health Care,Biotechnology: Pharmaceutical Preparations
KNSL,Kinsale Capital Group Inc. Common Stock,$398.84,-0.65,-0.163%,9278384826.00,United States,,180718,Finance,Property-Casualty Insurers
KNTK,Kinetik Holdings Inc. Class A Common Stock,$38.64,1.10,2.93%,6243646177.00,United States,2022,1666941,Utilities,Natural Gas Distribution
KNX,Knight-Swift Transportation Holdings Inc.,$56.65,-0.86,-1.495%,9196504350.00,United States,2017,2785948,Industrials,Trucking Freight/Courier Services
KRC,Kilroy Realty Corporation Common Stock,$37.70,-0.52,-1.361%,4460124965.00,United States,1997,1614919,Real Estate,Real Estate Investment Trusts
KRG,Kite Realty Group Trust Common Stock,$23.63,0.29,1.243%,5116036142.00,United States,2004,1756776,Real Estate,Real Estate Investment Trusts
KRYS,Krystal Biotech Inc. Common Stock,$285.04,3.03,1.074%,8265452816.00,United States,2017,278797,Health Care,Biotechnology: Biological Products (No Diagnostic Substances)
KSS,Kohl's Corporation Common Stock,$18.62,-0.64,-3.323%,2088962736.00,United States,1992,3300688,Consumer Discretionary,Department/Specialty Retail Stores
KTB,Kontoor Brands Inc. Common Stock ,$59.42,-0.16,-0.269%,3303372425.00,United States,2019,470934,Industrials,Garments and Clothing
KVYO,Klaviyo Inc. Series A Common Stock,$23.82,-1.78,-6.953%,7192336570.00,United States,2023,4468928,Technology,Computer Software: Prepackaged Software
KWR,Quaker Houghton Common Stock,$157.98,-2.82,-1.754%,2739378729.00,United States,,126351,Industrials,Major Chemicals
KYMR,Kymera Therapeutics Inc. Common Stock,$69.54,-1.58,-2.222%,5475661240.00,United States,2020,661828,Health Care,Biotechnology: Biological Products (No Diagnostic Substances)
LAD,Lithia Motors Inc. Common Stock,$332.05,-0.33,-0.099%,8052222462.00,United States,,169174,Consumer Discretionary,Retail-Auto Dealers and Gas Stations
LASR,nLIGHT Inc. Common Stock,$43.94,0.11,0.251%,2231537148.00,United States,2018,629446,Technology,Semiconductors
LAUR,Laureate Education Inc. Common Stock,$34.59,-0.83,-2.343%,5097499314.00,United States,2017,760740,Real Estate,Other Consumer Services
LBRDA,Liberty Broadband Corporation Class A Common Stock,$44.07,-1.08,-2.392%,6323585923.00,United States,,153509,Telecommunications,Cable & Other Pay Television Services
LBRDK,Liberty Broadband Corporation Class C Common Stock,$44.17,-1.17,-2.581%,6337934881.00,United States,,1426482,Telecommunications,Cable & Other Pay Television Services
LBRDP,Liberty Broadband Corporation Series A Cumulative Redeemable Preferred Stock,$24.10,-0.0932,-0.385%,3458098950.00,United States,,5899,Telecommunications,Cable & Other Pay Television Services
LBRT,Liberty Energy Inc. Class A common stock,$20.19,-0.27,-1.32%,3270112761.00,United States,2018,2374225,Energy,Oilfield Services/Equipment
LC,LendingClub Corporation Common Stock,$20.70,0.34,1.67%,2386739808.00,United States,2014,1479898,Finance,Finance: Consumer Services
LCID,Lucid Group Inc. Common Stock,$10.12,0.07,0.697%,3280584785.00,United States,,9329237,Industrials,Auto Manufacturing
LCII,LCI Industries,$137.40,0.62,0.453%,3324806574.00,United States,1995,160972,Consumer Discretionary,Auto Parts:O.E.M.
LEA,Lear Corporation Common Stock,$121.04,-4.09,-3.269%,6278365498.00,United States,,715117,Consumer Discretionary,Auto Parts:O.E.M.
LEGN,Legend Biotech Corporation American Depositary Shares,$22.14,0.03,0.136%,4065992358.00,United States,2020,1688596,Health Care,Biotechnology: Pharmaceutical Preparations
LEU,Centrus Energy Corp. Class A Common Stock,$331.03,24.93,8.144%,6028728953.00,United States,2014,1607435,Industrials,Mining & Quarrying of Nonmetallic Minerals (No Fuels)
LEVI,Levi Strauss & Co Class A Common Stock,$21.76,0.01,0.046%,8504451139.00,United States,2019,1703357,Consumer Discretionary,Apparel
LFST,LifeStance Health Group Inc. Common Stock,$7.25,-0.19,-2.554%,2820252037.00,United States,2021,1659768,Health Care,Medical/Nursing Services
LFUS,Littelfuse Inc. Common Stock,$297.28,3.48,1.184%,7402773511.00,United States,,262721,Energy,Electrical Products
LGN,Legence Corp. Class A Common stock,$49.59,3.28,7.083%,5223658309.00,United States,2025,1430753,Consumer Discretionary,Engineering & Construction
LGND,Ligand Pharmaceuticals Incorporated Common Stock,$192.97,-3.11,-1.586%,3797981508.00,United States,,219807,Health Care,Biotechnology: Pharmaceutical Preparations
LIF,Life360 Inc. Common Stock,$56.84,-2.95,-4.934%,4456285443.00,United States,2024,1072085,Technology,EDP Services
LINE,Lineage Inc. Common Stock,$36.34,-0.12,-0.329%,8296044973.00,United States,2024,1266974,Real Estate,Real Estate Investment Trusts
LKQ,LKQ Corporation Common Stock,$33.51,-0.42,-1.238%,8577420861.00,United States,2003,2796845,Consumer Discretionary,Motor Vehicles
LLYVA,Liberty Live Holdings Inc. Series A Liberty Live Group Common Stock,$82.73,0.47,0.571%,7602887000.00,United States,,106359,Consumer Discretionary,Services-Misc. Amusement & Recreation
LLYVK,Liberty Live Holdings Inc. Series C Liberty Live Group Common Stock,$84.00,0.41,0.49%,7719600000.00,United States,,395827,Consumer Discretionary,Services-Misc. Amusement & Recreation
LMAT,LeMaitre Vascular Inc. Common Stock,$88.27,1.77,2.046%,2002492690.00,United States,2006,197052,Health Care,Medical/Dental Instruments
LMND,Lemonade Inc. Common Stock,$79.41,-0.78,-0.973%,5934390854.00,United States,2020,1441908,Finance,Property-Casualty Insurers
LNC,Lincoln National Corporation Common Stock,$40.90,-0.62,-1.493%,7768507145.00,United States,,1931437,Finance,Life Insurance
LNTH,Lantheus Holdings Inc. Common Stock,$64.25,-1.17,-1.788%,4260531801.00,United States,2015,737897,Health Care,Biotechnology: In Vitro & In Vivo Diagnostic Substances
LOAR,Loar Holdings Inc. Common Stock,$74.86,1.77,2.422%,7008578179.00,United States,2024,527408,Industrials,Military/Government/Technical
LOPE,Grand Canyon Education Inc. Common Stock,$178.29,-1.71,-0.95%,4986499586.00,United States,2008,363885,Real Estate,Other Consumer Services
LPX,Louisiana-Pacific Corporation Common Stock,$93.14,-0.57,-0.608%,6486591958.00,United States,,829478,Basic Materials,Forest Products
LQDA,Liquidia Corporation Common Stock,$37.93,-0.86,-2.217%,3299738670.00,United States,2018,3325507,Health Care,Biotechnology: Pharmaceutical Preparations
LRN,Stride Inc. Common Stock,$69.71,-0.08,-0.115%,3057384888.00,United States,,795306,Real Estate,Other Consumer Services
LSTR,Landstar System Inc. Common Stock,$153.55,-2.45,-1.571%,5273628992.00,United States,1993,565706,Industrials,Trucking Freight/Courier Services
LTH,Life Time Group Holdings Inc. Common Stock,$27.14,0.45,1.686%,5984702139.00,United States,2021,1634393,Consumer Discretionary,Hotels/Resorts
LUMN,Lumen Technologies Inc. Common Stock,$8.45,-0.20,-2.312%,8666689603.00,United States,,11201808,Telecommunications,Telecommunications Equipment
LUNR,Intuitive Machines Inc. Class A Common Stock,$21.58,2.08,10.667%,3889127056.00,United States,2021,19562426,Industrials,Industrial Machinery/Components
LW,Lamb Weston Holdings Inc. Common Stock ,$43.33,-0.60,-1.366%,6017665374.00,United States,2016,2243942,Consumer Staples,Packaged Foods
LXP,LXP Industrial Trust Common Stock (Maryland REIT),$51.28,0.90,1.786%,3033665572.00,United States,,447227,Real Estate,Real Estate Investment Trusts
LYFT,Lyft Inc. Class A Common Stock,$18.33,-0.55,-2.913%,7320147785.00,United States,2019,15507151,Real Estate,Real Estate
M,Macy's Inc Common Stock,$21.74,0.17,0.788%,5780298790.00,United States,,5445232,Consumer Discretionary,Department/Specialty Retail Stores
MAC,Macerich Company (The) Common Stock,$18.74,0.42,2.293%,4799652894.00,United States,1994,1805221,Real Estate,Real Estate Investment Trusts
MAIN,Main Street Capital Corporation Common Stock,$63.96,-0.24,-0.374%,5730019250.00,United States,2007,464495,Finance,Finance/Investors Services
MARA,MARA Holdings Inc. Common Stock,$11.36,0.70,6.567%,4296174250.00,United States,,51843210,Technology,EDP Services
MASI,Masimo Corporation Common Stock,$142.05,2.18,1.559%,7630066455.00,United States,2007,863953,Health Care,Biotechnology: Electromedical & Electrotherapeutic Apparatus
MAT,Mattel Inc. Common Stock,$21.04,-0.71,-3.264%,6539232000.00,United States,,2258383,Consumer Discretionary,Recreational Games/Products/Toys
MATX,Matson Inc. Common Stock,$146.26,0.29,0.199%,4560391919.00,United States,,397519,Consumer Discretionary,Marine Transportation
MC,Moelis & Company Class A Common Stock,$77.52,-0.23,-0.296%,6071425083.00,United States,2014,954942,Finance,Investment Managers
MCHB,Mechanics Bancorp Class A Common Stock,$14.59,-0.10,-0.681%,3227507154.00,United States,2012,374267,Finance,Major Banks
MCY,Mercury General Corporation Common Stock,$91.09,-0.30,-0.328%,5045350033.00,United States,,278703,Finance,Property-Casualty Insurers
MDU,MDU Resources Group Inc. Common Stock (Holding Company),$20.66,0.24,1.175%,4222549082.00,United States,,1901312,Industrials,Mining & Quarrying of Nonmetallic Minerals (No Fuels)
MFAN,MFA Financial Inc. 8.875% Senior Notes due 2029,$25.48,0.01,0.039%,2615998527.00,United States,2024,13579,Real Estate,Real Estate Investment Trusts
MFAO,MFA Financial Inc. 9.000% Senior Notes due 2029,$25.59,0.01,0.039%,2627292084.00,United States,2024,6086,Real Estate,Real Estate Investment Trusts
MFICL,MidCap Financial Investment Corporation 8.00% Notes due 2028,$25.2999,0.0299,0.118%,2360572306.00,United States,,4541,Finance,Finance/Investors Services
MGEE,MGE Energy Inc,$79.58,-0.37,-0.463%,2908000343.00,United States,,119237,Energy,Electric Utilities: Central
MGM,MGM Resorts International Common Stock,$34.98,-0.43,-1.214%,9567255271.00,United States,,5311810,Consumer Discretionary,Hotels/Resorts
MGNI,Magnite Inc. Common Stock,$14.38,-0.52,-3.49%,2065656356.00,United States,,3122656,Technology,Computer Software: Programming Data Processing
MGRC,McGrath RentCorp Common Stock,$110.12,-0.655,-0.591%,2710235669.00,United States,1984,101804,Consumer Discretionary,Diversified Commercial Services
MGY,Magnolia Oil & Gas Corporation Class A Common Stock,$22.60,0.11,0.489%,4264078029.00,United States,2017,2462421,Energy,Oil & Gas Production
MHK,Mohawk Industries Inc. Common Stock,$122.84,-0.84,-0.679%,7594136108.00,United States,,616948,Consumer Discretionary,Home Furnishings
MHO,M/I Homes Inc. Common Stock,$137.16,-1.84,-1.324%,3586529494.00,United States,1993,155109,Consumer Discretionary,Homebuilding
MIDD,Middleby Corporation (The) Common Stock,$148.53,-0.32,-0.215%,7481641763.00,United States,,839718,Industrials,Industrial Machinery/Components
MIR,Mirion Technologies Inc. Class A Common Stock,$26.93,-0.07,-0.259%,6834866047.00,United States,2020,1754958,Industrials,Industrial Machinery/Components
MIRM,Mirum Pharmaceuticals Inc. Common Stock,$91.05,-1.27,-1.376%,4679384913.00,United States,2019,336130,Health Care,Biotechnology: Pharmaceutical Preparations
MKTX,MarketAxess Holdings Inc. Common Stock,$176.08,1.42,0.813%,6545159129.00,United States,2004,574267,Finance,Investment Bankers/Brokers/Service
MLYS,Mineralys Therapeutics Inc. Common Stock,$32.74,1.36,4.334%,2591042159.00,United States,2023,1379613,Health Care,Biotechnology: Pharmaceutical Preparations
MMS,Maximus Inc. Common Stock,$98.32,-0.10,-0.102%,5354655368.00,United States,1997,346310,Real Estate,Real Estate
MMSI,Merit Medical Systems Inc. Common Stock,$82.31,1.96,2.439%,4880180313.00,United States,,885041,Health Care,Medical/Dental Instruments
MOD,Modine Manufacturing Company Common Stock,$136.88,5.02,3.807%,7206535988.00,United States,,1268929,Consumer Discretionary,Auto Parts:O.E.M.
